,Unnamed: 0,link,title,price,rating,ratingCount,stock,description,size,color,material,filter type,gender,disposability,earloop,score
260,260,/WeCare-Disposable-Face-Individually-Wrapped/dp/B08DTDSC7Z/ref=sr_1_189?dchild=1&keywords=face+mask&qid=1618898749&s=hpc&sr=1-189,"WeCare Disposable Face Mask Individually Wrapped - 50 Pack, Tie Dye Masks 3 Ply",,4.8 out of 5 stars,"5,600 ratings",In Stock.," READY TO GO: Each mask in this box is individually sealed so they are perfect to throw in your purse, backpack, gym bag, or even stash in your pocket! Perfect for dispensers, offices, schools and reception areas. LIGHT & BREATHABLE: Designed for the utmost in comfort, these individual masks are painless and adjustable. They offer full coverage of the nose and mouth and are comfortable for extended wear, including air travel. 3 PROTECTIVE LAYERS: The innermost layer is super soft and gentle on the skin, and the outer leak-proof layer covers the high density filter. Made with non-woven materials, these paper masks are latex free. EFFECTIVE FILTRATION: The glass free filter is effective at filtering many types of particles. Perfect for everyday wear. An adjustable wire runs along the top to serve as an adjustable nose clip. MULTI USE COLORED MASKS: Designed for non medical use, these disposable masks come in all kinds of colors and in both kids and adult sizes. Also available are black, blue, pink, tie dye, navy, red, peach, plaid and other colors!",childrens,various,non-woven melt-spray,3 ply,mens,disposable,,1
116,116,/Dr-Talbots-Disposable-Personal-Health/dp/B08QG5LLPG/ref=sr_1_86?dchild=1&keywords=face+mask&qid=1618898461&s=hpc&sr=1-86,"Dr. Talbot's Disposable Kid's Face Mask for Personal Health, Boy 2-5 Years, Prints May Vary, 10 Count",,4.8 out of 5 stars,"1,070 ratings",In Stock.," Pack of 10 This mask is not FDA-approved, not intended for medical use, and not proven to reduce the transmission of disease The CDC recommends use of cotton or cloth face coverings in public to reduce community spread by asymptomatic persons Dispose after single use",childrens,red,cotton,,boys,disposable,,1
264,264,/VELCRO-Brand-Comfortable-Adjustable-VEL-30084-USA/dp/B08CNM5VR8/ref=sr_1_193?dchild=1&keywords=face+mask&qid=1618898749&s=hpc&sr=1-193,"VELCRO Brand Face Mask Extender Straps 4pk Black, 12” x 1” Comfortable and Adjustable Ear Savers, VEL-30084-USA",,4.2 out of 5 stars,"3,920 ratings",In Stock.," SOFT AND COMFORTABLE – Specifically designed for use on the head with a facemask, will not catch in hair; soft materials for ultimate comfort. EAR SAVERS – Make wearing masks more comfortable by using VELCRO Brand Mask Extender Straps to extend your face mask ear loops behind your head; relieves pain and pressure on ears caused by wearing your mask for an extended time. VERSATILE MASK ACCESSORY - For use with most masks including cloth, disposable, homemade or DIY masks and more; adjustable for comfort and custom fit; made in North America. MAXIMUM ADJUSTABILITY – Adjust the extender strap to fit your mask to your face; no limitations by fixed number of adjustment points like most plastic straps, provides a perfect custom fit. REUSABLE, HANDWASHABLE, MULTI-USE – Use with your mask every day, hand washable construction, use your extender multiple times.",universal,black,,,unisex,disposable,adjustable,1
122,122,/WeCare-Disposable-Face-Individually-Wrapped/dp/B08SJ73QSM/ref=sr_1_92?dchild=1&keywords=face+mask&qid=1618898461&s=hpc&sr=1-92,"WeCare Disposable Face Mask Individually Wrapped - 50 Pack, Spring Print Masks - 3 Ply",,4.8 out of 5 stars,257 ratings,," READY TO GO: Each mask in this box is individually sealed so they are perfect to throw in your purse, backpack, gym bag, or even stash in your pocket! Perfect for dispensers, offices, schools and reception areas. LIGHT & BREATHABLE: Designed for the utmost in comfort, these individual masks are painless and adjustable. They offer full coverage of the nose and mouth and are comfortable for extended wear, including air travel. 3 PROTECTIVE LAYERS: The innermost layer is super soft and gentle on the skin, and the outer leak-proof layer covers the high density filter. Made with non-woven materials, these paper masks are latex free. EFFECTIVE FILTRATION: The glass free filter is effective at filtering many types of particles. Perfect for everyday wear. An adjustable wire runs along the top to serve as an adjustable nose clip. MULTI USE COLORED MASKS: Designed for non medical use, these disposable masks come in all kinds of colors and in both kids and adult sizes. Also available are black, blue, pink, tie dye, navy, red, peach, plaid and other colors!",childrens,various,non-woven melt-spray,3 ply,mens,disposable,,1
137,137,/gp/slredirect/picassoRedirect.html/ref=pa_sp_atf_next_hpc_sr_pg5_1?ie=UTF8&adId=A08587113O0LLS4B9YNSH&url=%2FComix-Face-Masks-3-Layer-Disposable-L707%2Fdp%2FB08GW3C7SY%2Fref%3Dsr_1_99_sspa%3Fdchild%3D1%26keywords%3Dface%2Bmask%26qid%3D1618898528%26s%3Dhpc%26sr%3D1-99-spons%26psc%3D1&qualifier=1618898528&id=8734428636716434&widgetName=sp_atf_next,"Comix Disposable Face-Masks with 3-Layer Adult Masks, L707 Pack of 100",,4.7 out of 5 stars,181 ratings,In Stock.," Elastic closure 3 Layers: 3-Ply Black Disposable Face Masks, non-Woven material with Filtering Effective >95% , each 10pcs Sealed in One Individual Package, Pack of 100 Keep Safe: These Face masks are class 1 medical devices, and can be used for healthcare use, but should not be used in surgical or high risk situations, or where there is a high risk of contact with liquids or infectious materials. Comfort & Breathable: Made with non-woven fabric for effective airway protection from small particles and droplets. Soft, non-irritating, comfortable and breathable. Adjustable earloop and nose clip fits for most of faces. Perfect for men, women, adults. Care: Protect ourself and our loved ones with this disposable face masks in various environments such as home, office, school, gardening, construction, and also the work places as other public areas to help protect from allergens, dust and germs. One Time Use: All these disposable masks are not recommend washable or reusable but for one time use and recommend to replace by each 4 hours.","small, adult, ",black,non-woven melt-spray,3-ply,unisex,disposable,adjustable,1
138,138,/Ceemly-3Ply-Made-Face-Mask/dp/B08NQZL7JR/ref=sr_1_100?dchild=1&keywords=face+mask&qid=1618898528&s=hpc&sr=1-100,"Ceemly 3Ply USA Made Face Mask - Disposable, Single-Use, 50 CT",,4.4 out of 5 stars,579 ratings,In Stock.," The Ultimate American Made Disposable Face Mask - The Ceemly Face Mask is made with 3 layers of protection featuring an external hydrophobic & durable cloth layer, melt-blown polymer middle layer + a soft interior comfortable cloth layer. These disposable face masks also come with a seamless crimping design and adjustable nose bridge to decrease the space between the face and the cloth layer for maximum coverage while keeping it breathable. Disposable Face Mask with Elastic Straps - The Ceemly disposable face protection pack comes with reinforced elastic straps that securely yet comfortably fit over your ears. They won’t strain you, making it perfect for long hours of wear. Whether for work, groceries, or exercise, they will provide a comfortable fit for everyday activity. Made with You in Mind - Ceemly values your satisfaction just as much as we value quality. If you experience any concerns with your face protection, don’t hesitate to reach out to us so we can patch things up with a refund or replacement. The Go-To Disposable Face Masks for Americans Everywhere - Proudly made in Garden Grove, California, the Ceemly Disposable Face Mask was made for Americans, by Americans. Boasting of a style that fits most sizes while still giving reliable protection, we maximize the design of every single-use face mask so you don’t have to look anywhere else. Your Everyday Staple - With ASTM-met standards, you can trust our face protection pack is made through accountable and reliable sourcing, manufacturing, and distribution. Produced with the goal of achieving better air that’s accessible for everyone, let Ceemly be one of your everyday staples.",universal,,melt-blown,3 layer,mens,disposable,elastic,1
12,12,/Comix-Disposable-Face-mask-Procedural-masks-L707/dp/B0888PX9VN/ref=sr_1_11?dchild=1&keywords=face+mask&qid=1618898243&s=hpc&sr=1-11,"Disposable Face Mask,Face Masks of 50 Pack Disposable Mask",,4.6 out of 5 stars,"8,896 ratings",In Stock.," Mask Imported 50pcs disposable face mask per box, blue color Non-sterile,, this mask Is not intended for medical use. High quality Non woven fabric masks with 3 layers protection Extra soft with maximum comfort and breathable Recommend to replace a new mask in every 4 hours",universal,blue,non-woven melt-spray,3 layer,unisex,disposable,,1
140,140,/sckang-Disposable-Comfortable-Earloop-Multicolor/dp/B08J3VYBM4/ref=sr_1_102?dchild=1&keywords=face+mask&qid=1618898528&s=hpc&sr=1-102,sckang 50 Pcs Disposable Face Mask Comfortable Earloop Mask 3-Layer Multicolor Masks,,4.7 out of 5 stars,"1,039 ratings",In Stock.," 3 Layers of Material - The mask is made of 3 layers of high-quality non-woven fabric; it has a stronger filtering effect and is more warm and breathable Comfortable - Extra-soft elastic ear loops eliminate pressure to the ears for maximum comfort. Can be used with earloop holders/ mask strap extenders for additional comfort and well-being. These Masks Should Be Disposed of after Each Use Keep the Blue-side Outside and the Nose Clip on the Upper Side Quantity: 50 pieces/box, completely meet your family /staff /friends' demands. Single-Use face masks for adults and children. Suitable for home, office, school, outdoor and other public places.",childrens,blue,non-woven melt-spray,3 layer,unisex,disposable,elastic,1
135,135,/gp/slredirect/picassoRedirect.html/ref=pa_sp_btf_hpc_sr_pg4_1?ie=UTF8&adId=A0434125T2S53KURNNM6&url=%2FComix-Face-Mask-3-Layer-Black-Disposable%2Fdp%2FB08GJRDC3B%2Fref%3Dsr_1_105_sspa%3Fdchild%3D1%26keywords%3Dface%2Bmask%26qid%3D1618898461%26s%3Dhpc%26sr%3D1-105-spons%26psc%3D1&qualifier=1618898461&id=7995795376940918&widgetName=sp_btf,"Disposable Face Mask,Face Masks of 50 Pack Disposable Mask",,4.7 out of 5 stars,"4,918 ratings",In Stock.," Non Woven Melt Blown Fabric Imported 3 layers closure 3-Ply Black Face Masks, each 10pcs Sealed in One Individual Bag and Total 50pcs in Giftbox. Easy to Use. These Face masks are not intended for medical use. Made with 3-Layer non-woven fabric for effective airway protection from small particles and droplets. Soft, non-irritating, comfortable and breathable. Adjustable earloop and metal nose clip fits for most of faces. Protect ourselves and our loved ones with this disposable face masks in various environments such as home, office, school, gardening, construction, and also the work places as other public areas to help protect from allergens, dust. All these masks are for one time use and recommend to replace by each 4 hours.","small, ",black,non-woven melt-spray,3-ply,unisex,disposable,adjustable,1
273,273,/gp/slredirect/picassoRedirect.html/ref=pa_sp_atf_next_hpc_sr_pg9_1?ie=UTF8&adId=A0434125T2S53KURNNM6&url=%2FComix-Face-Mask-3-Layer-Black-Disposable%2Fdp%2FB08GJRDC3B%2Fref%3Dsr_1_194_sspa%3Fdchild%3D1%26keywords%3Dface%2Bmask%26qid%3D1618898816%26s%3Dhpc%26sr%3D1-194-spons%26psc%3D1&qualifier=1618898816&id=272784280724067&widgetName=sp_atf_next,"Disposable Face Mask,Face Masks of 50 Pack Disposable Mask",,4.7 out of 5 stars,"4,918 ratings",In Stock.," Non Woven Melt Blown Fabric Imported 3 layers closure 3-Ply Black Face Masks, each 10pcs Sealed in One Individual Bag and Total 50pcs in Giftbox. Easy to Use. These Face masks are not intended for medical use. Made with 3-Layer non-woven fabric for effective airway protection from small particles and droplets. Soft, non-irritating, comfortable and breathable. Adjustable earloop and metal nose clip fits for most of faces. Protect ourselves and our loved ones with this disposable face masks in various environments such as home, office, school, gardening, construction, and also the work places as other public areas to help protect from allergens, dust. All these masks are for one time use and recommend to replace by each 4 hours.","small, ",black,non-woven melt-spray,3-ply,unisex,disposable,adjustable,1
146,146,/Childrens-Anti-Microbial-Adjustable-Breathable-coRevival/dp/B08CZ13CMV/ref=sr_1_105?dchild=1&keywords=face+mask&qid=1618898528&s=hpc&sr=1-105,"Kids Face Mask 2-Pack | Anti-Microbial, Reusable, Cloth, Adjustable | The Revival Kids Mask by coRevival",,4.5 out of 5 stars,"3,714 ratings",In Stock.," EVERYDAY COMFORT: Soft and breathable, the 2-fabric layers allows your child to wear their Revival Kid's Mask all day without irritation or discomfort. We made the Revival Kid's Mask with a 2-piece panel design to ensure a comfortable fit that stays in place while talking or during activity. ADJUSTABLE: The one-size kids mask comes equipped with adjustable ear straps to ensure a perfect and secure fit that doesn't pull on your ears while wearing. WASHABLE & REUSABLE: The Revival Kid's Mask is machine washable (cold water only!), allowing your child to reuse multiple times - no more uncomfortable disposable masks. PROTECTION: The Revival Kid's Mask consists of 2 fabric layers with an anti-microbial (EPA registration no. 3090-255) coating. The build-in nose flap is designed to provide a protective seal (with the added benefit of preventing glasses from fogging). FUNCTIONAL DESIGN: Contoured design to fit the shape of your child's face.",childrens,red,,,unisex,disposable,adjustable,1
21,21,/Disposable-Face-Masks-Black-Mask/dp/B08M32ZRKY/ref=sr_1_20?dchild=1&keywords=face+mask&qid=1618898243&s=hpc&sr=1-20,"100 Pcs Disposable Face Masks, 3 Ply Face Masks Black Disposable Mask",,4.6 out of 5 stars,"6,548 ratings",In Stock.," ❗❗❗Considering safety and tightness, our masks are all vacuum packed,so it may be squeezed or wrinkled, just take it out and the masks will automatically flatten.We pay much attention to the quality of the masks, so we would perform sanitation and disinfection many times, there may be a bit of smell, it is safe and protective, pls don't worry. It will not effect the use of masks! High quality: Disposable face masks are made of breathable premium non woven fabric, soft and comfortable, gentle to skin.Designed with three layers of protection,which is ideal for daily use. Universal Design: The Extra-soft elastic ear loops could eliminate pressure to the ears for maximum comfort. It can be used with earloop holders for additional comfort. High-quality fiber is also extremely breathable. Daily Protection: Keeping you away from smoke, debris, residue, pollutants, and is also perfect protects against pet or pollen allergens, and help prevent coughing and sneezing water from entering the nose and mouth. Applications and occasion: Protective mouth cover mask, perfect for indoor, outdoor, home, office, travel, shopping, schools, beauty and personal use to protect against dust, pet dander, pollen, smog, and other air pollutants, public occasions.","universal, ",black,non-woven melt-spray,3 ply,mens,disposable,elastic,1
147,147,/Single-Pullout-Comfort-Earloop-Disposable/dp/B086T5JWBQ/ref=sr_1_106?dchild=1&keywords=face+mask&qid=1618898528&s=hpc&sr=1-106,"Single Use Pullout Comfort Earloop Disposable Face Mask (Pack of 50), Blue - Latex Free",,3.7 out of 5 stars,"5,503 ratings",In Stock.," This product arrives in a poly-bag. 50 Pack Outer Layer: 100% Spunbond Polypropylene; Middle Layer: 100% Melt Blown Polypropylene; Inner Layer: 100% Spunbond Polypropylene Imported This mask is not intended for medical use, and not proven to reduce the transmission of disease. Made in China Manufactured by Asia Masks Inc.",universal,various,non-woven melt-spray,,mens,disposable,,1
148,148,/Wish-Disposable-Face-Mask-Pack/dp/B087NC93FX/ref=sr_1_107?dchild=1&keywords=face+mask&qid=1618898528&s=hpc&sr=1-107,Wish Disposable Face Mask 3 Ply,,4.5 out of 5 stars,"4,278 ratings",," Disposable Face Mask - general use Pack of 50 masks. 24 Packs in BOX, 1200 MASK Keep the blue-side outside and the nose clip on the upper side. 3-ply, with a melt-blown polypropylene filtration layer. BULK WHOLESALE PRICING",universal,blue,mixed material,3-ply,unisex,disposable,,1
542,542,/Disposable-Breathable-Designs-Colorful-Adjustable/dp/B08QJF2KTB/ref=sr_1_389?dchild=1&keywords=face+mask&qid=1618899365&s=hpc&sr=1-389,"Disposable Face Masks for Women and Men, Breathable 3- Ply Face Mask with Designs, Colorful Cute Lace Fashion Pattern, Adjustable Nose Wire and Elastic Ear Loops. 50Pcs",,4.5 out of 5 stars,46 ratings,In Stock.," 👉【Three Layers Breathable Face Mask】: The disposable face mask are made of high quality. Outer layer help to block the polluted air particles. Middle layer has good air filtration.The inner layer is breathable and skin-friendly. 👉【Fashion Disposable Face Mask with Design】: The disposable face mask with sexy and elegance lace print pattern, make you look more fashionable and chic, suitable for women, lady, girls and most people. Notice it's printed pattern not lace material. 👉【Friendly Design Face Mask】: Face mask disposable with strong and soft elastic ear loops, pose less press to ears and face, suitable for long time to wear. Designer face mask with adjustable and bendable metal nose clip fits your face better. 👉【Widely application】: There are five color fancy lace face mask in the box.You can choose a matching color mask according to your mood or clothing. It can be used for any occasions. Suitable for costume parties, office, wedding, cocktail parties etc. Applies to outdoor and indoor Size: 6.8“ x 3.7“, Using 5 individual packages, 10 Pcs are packed in each plastic bag. It will be more sanitary and convenient in daily use. 50Pcs in the box.",childrens,colorful,,,unisex,disposable,elastic,0
544,544,/TecUnite-Disposable-Breathable-Filter-Elastic/dp/B07B8PSHMS/ref=sr_1_391?dchild=1&keywords=face+mask&qid=1618899365&s=hpc&sr=1-391,"TecUnite 100 Pack Disposable Face Breathable Dust Filter Mouth Cover Masks with Elastic Ear Loop (Black), one Size",,4.4 out of 5 stars,"6,474 ratings",In Stock., fiber fabric Imported fiber fabric Imported TecUnite 100 Pack Disposable Face Masks Breathable Dust Filter Masks Mouth Cover Masks with Elastic Ear Loop (Black) item length: 7.05 inches,universal,black,,,unisex,disposable,elastic,0
125,125,/EHH-Disposable-Breathable-Comfortable-Elastic/dp/B08CVCVPL8/ref=sr_1_95?dchild=1&keywords=face+mask&qid=1618898461&s=hpc&sr=1-95,"Black Disposable Face Mask, Face Mask for Man and Women, Breathable & Comfortable, 3- Ply, with Adjustable Nose Wire & Elastic Ear Loop (50 Pcs), Black",,4.6 out of 5 stars,"3,771 ratings",In Stock.," 【Three Layers Protection Face Mask】: The black disposable face mask are made of high quality thickening material. Outer layer help to block the polluted air particles. Middle layer has good air filtration. The inner layer is breathable and gentle. 【Breathable & Comfortable Face Mask Design】: Soft layer are gentle to skin, the face mask with elastic ear loops, eliminate press to ears and face, suitable for long time to wear. 【Humanize Face Mask Design】: Adjustable metal nose clip keep tightness but still breathable, fits your face better. Suitable for men, women and most people. 【Widely application】: Suitable for people in the haze, fog, dust weather, etc. It not only applies to private places such as home and office, but also applies to public places such as school and outdoor. Effectively prevent pollution, liquid and dust. Size: 6.8“ x 3.7“(±5%). This face mask are disposable and cannot be reused. We upgraded most face masks to be individually packaged. It will replace which vacuum sealed in packs of 10 each before. They are more hygienic and more convenient to carry.",universal,black,,,unisex,disposable,elastic,0
90,90,/LUXSENZ-Disposable-Breathable-Stretchable-Earloops/dp/B0894X579Z/ref=sr_1_68?dchild=1&keywords=face+mask&qid=1618898393&s=hpc&sr=1-68,LUXSENZ 50pcs,,4.5 out of 5 stars,817 ratings,In Stock.," 【Easy to carry and safe】 Easy to carry and safe,50 PCS Per box. Size: 6.9×3.74（IN） 【Black Disposable Face Masks】Made of high-quality non-woven material, the disposable masks are skin-friendly, comfortable and breathable. 【Universal Design Mask】The Extra-soft elastic ear loops could eliminate pressure to the ears for maximum comfort. It can be used with earloop holders for additional comfort. High-quality fiber is also extremely breathable. 【Mask Easy to Use】Hold the elastic bands over your ears and press the metal strip around your nose to create a light seal around your face. Note: General size, also suitable for teenagers. 【Masks Applicable scene】Our essential personal protective masks are worn all over the world in most common workplace environments. They are used by Food Service, Retailers, Warehouses, Offices, Schools, both Indoors and Outdoors.","universal, ",black,non-woven melt-spray,,unisex,disposable,elastic,0
491,491,/gp/slredirect/picassoRedirect.html/ref=pa_sp_mtf_hpc_sr_pg15_1?ie=UTF8&adId=A09359853LCFF43K1ZZTD&url=%2F100PCS-disposable-shield-filter-protection%2Fdp%2FB08C7HDF1F%2Fref%3Dsr_1_354_sspa%3Fdchild%3D1%26keywords%3Dface%2Bmask%26qid%3D1618899231%26s%3Dhpc%26sr%3D1-354-spons%26psc%3D1&qualifier=1618899231&id=1431849588770025&widgetName=sp_mtf,100PCS 3 ply black disposable face mask filter protection face masks,,4.7 out of 5 stars,"21,505 ratings",In Stock.," 1.3 Layers face mask -It's made of 3 layers of high-quality non-woven fabric; it has a stronger filtering effect and is more warm and breathable. 2.Unique Designed Masks - Comfortable elastic earloop, extra-soft ear loops eliminate pressure to the ears. Inner layer is made of soft facial tissue, no dye, gentle to the skin. 3.Made of environmental friendly material,Great choices for you or your family.Take care of yourself and hope all of trouble will be end as soon as possible.Good luck to everyone and hope all is well. 4.Black disposable face mask which great for painting, construction, building site, nail salons,fog and haze weather,gray sky,dust weather, snow weather and more 5.High quality face masks,package include 100PCS,please confirm carefully when placing an order",universal,various,non-woven melt-spray,3 ply,unisex,disposable,elastic,0
77,77,/Disposable-Breathable-Stretchable-Earloops-Outdoors/dp/B08HT31TWH/ref=sr_1_55?dchild=1&keywords=face+mask&qid=1618898393&s=hpc&sr=1-55,"50 PCS Black Disposable Face Masks Breathable Dust Mask with Stretchable Earloops Black Face Mask for Adult, Men, Women, Outdoors",,4.6 out of 5 stars,"11,366 ratings",In Stock.," 3-LAYERS MASKS - This big bulk of masks should keep you confident you won’t run out quickly. With a melt-blown polypropylene filtration layer, keep your mouth covered and protected from pollution,chemicals, fluids and dust with this Disposable Face Mask Value Pack. Three Layers of Protection, More Peace of Mind. FEATURE - Breathable and comfortable disposable earloop mask is made of a 3-ply construction. The lightweight masks are designed to provide comfort and easy breathing. Masks bulk which is for Adult, Men, Women, Indoor, Outdoor Use. IDEAL IN ANY SETTING - Our disposable face masks are suitable for adults and kids of all ages. Can be used for outdoor public areas, schools, offices, and home usage. With the new 3-ply design, It can help block pollution so you can breathe easily and safely in any environment. Each pack of 50 pieces, easy to use and hygienic.Each box contains 50 earrings disposable face masks, light and comfortable, easy to breathe when worn.Soft and elastic earrings provide you with a light wearing experience.Easy to use, can cover the mouth, nose, chin. GENTLE TO YOUR SKIN: Unlike other protection face masks, our nose and mouth masks are soft and lightweight. The face masks are gentle on the skin and feel comfortable and easy to put on and take off.",childrens,various,mixed material,3-ply,unisex,disposable,elastic,0
495,495,/Colorful-Adult-Breathable-Disposable-Non-Woven/dp/B08DTPYS77/ref=sr_1_358?dchild=1&keywords=face+mask&qid=1618899231&s=hpc&sr=1-358,"Colorful Adult Face Mask 50 Pack Daily Use, Breathable Disposable Masks Non-Woven Mouth Cover",,4.8 out of 5 stars,23 ratings,In Stock.," non-woven 【Premium 3-layer non-woven mask】: Made of high quality high-density non-woven fabric that is soft, comfortable and gentle on the skin. A inner layer, a filtering middle layer and a non-woven outer layer to provide excellent dust, droplets protection. 【Considerate Design】: Adjustable embedded nose clip can help fit the nose bridge, reduce the fogging on the eyeglasses.The sides wrap nicely and fit the cheeks. 【Elastic ear loop】: high elastic ear loop, pose less press to ears and face, avoid the uncomfortableness from long-time use. 【Reliable protection】: Our 50-pack of masks are safely packaged in a protective retail box pouch, Aseptically sealed for safe use.Process the order within 24 hours. U.S. local warehouse inventory. 【50Pcs disposable mask】: five colors, say goodbye to monotony. Sizes are perfect for adults, daily use, home and office, school and outdoors, service personnel and personal needs for the perfect personal care kit!","adult, ",various,non-woven melt-spray,,unisex,disposable,elastic,0
