,Unnamed: 0,link,title,price,rating,ratingCount,stock,description,size,color,material,filter type,gender,disposability,earloop,score
231,231,/Disposable-Breathable-Comfortable-Coverings-Elastic/dp/B08WHM7NBJ/ref=sr_1_168?dchild=1&keywords=face+mask&qid=1618898676&s=hpc&sr=1-168,Black Disposable Face Mask (50 Face Masks) 3-Ply Breathable Comfortable Nose/Mouth Coverings for Home & Office | Elastic Ear Loop 3-Layer Safety Shield for Adults,,4.5 out of 5 stars,102 ratings,In Stock.," THE ULTIMATE MULTIPURPOSE MASK | Disposable Throwaway Face Masks Provide Fast, Effective Protection | Great for Airport Travel, Public Transportation, Social Distancing, Cleaning, Grocery Shopping POWERFUL 3-LAYER PROTECTIVE BARRIER | Stretchy Design Offers Easy Adjustment, Maximum Chin/Mouth/Nose Coverage & Exceptional Comfort | Interior Wire Creates a Strong Seal Around Nose, Helping to Create a Tight Seal & Stop Glasses from mist over | Non-Woven Fabric is Breathable & Soft on Skin DISPOSABLE & SUSTAINABLE | Eco-Conscious Design Incorporates Durable, Economically Viable Materials for Everyday Use & Convenient Disposal | Block and Filter Out Construction Dust & Prevent particles from Entering Nose & Mouth—Without the Green Guilt UNIVERSAL ELASTIC-STYLE EAR HOOKS | Soft, Thin, Comfortable Ear Bands Prevent Headaches When Wearing for Long Periods of Time & Allow for Easy Modifications When Fitting to Both Adults & Small Children | Convenient One-Size-Fits-All Styling Safeguards Everyone—Perfect For Families, Office & Warehouse Workers & More STOCK UP & SAVE BY BUYING IN BULK | Large Lot of 50 Individual Safety Masks Lasts the Life of Any Project | Safe, Affordable & Super Versatile for City Streets, Malls, Parks, Cycling, Sports, Stores, Schools & More",childrens,various,non-woven melt-spray,3-ply,unisex,disposable,elastic,0
346,346,/gp/slredirect/picassoRedirect.html/ref=pa_sp_atf_next_hpc_sr_pg11_1?ie=UTF8&adId=A10015852K023VDK3XUJR&url=%2Fsckang-Disposable-3-Ply-Masks-Black%2Fdp%2FB08J4BJBT4%2Fref%3Dsr_1_242_sspa%3Fdchild%3D1%26keywords%3Dface%2Bmask%26qid%3D1618898965%26s%3Dhpc%26sr%3D1-242-spons%26psc%3D1&qualifier=1618898965&id=5890693124632213&widgetName=sp_atf_next,sckang Face Mask Disposable 3-Ply Face Masks of 50 Pcs Black,,4.7 out of 5 stars,"1,039 ratings",In Stock.," 3 Layers of Material - The mask is made of 3 layers of high-quality non-woven fabric; it has a stronger filtering effect and is more warm and breathable Comfortable - Extra-soft elastic ear loops eliminate pressure to the ears for maximum comfort. Can be used with earloop holders/ mask strap extenders for additional comfort and well-being. These Masks Should Be Disposed of after Each Use Keep the Blue-side Outside and the Nose Clip on the Upper Side Quantity: 50 pieces/box, completely meet your family /staff /friends' demands. Single-Use face masks for adults and children. Suitable for home, office, school, outdoor and other public places.",childrens,various,non-woven melt-spray,3-ply,unisex,disposable,elastic,0
345,345,/gp/slredirect/picassoRedirect.html/ref=pa_sp_btf_hpc_sr_pg10_1?ie=UTF8&adId=A0950100S2LSADYRJJM1&url=%2FPrivate-Profile-Face-Mask-Reusable%2Fdp%2FB08H9NSZZ5%2Fref%3Dsr_1_249_sspa%3Fdchild%3D1%26keywords%3Dface%2Bmask%26qid%3D1618898893%26s%3Dhpc%26sr%3D1-249-spons%26psc%3D1&qualifier=1618898893&id=3507688794457423&widgetName=sp_btf,Private Profile Face Mask Designed By Lus Kaos- Limited Edition,,Previous page of related Sponsored Products,,In Stock.,,universal,,,,unisex,,,0
344,344,/gp/slredirect/picassoRedirect.html/ref=pa_sp_btf_hpc_sr_pg10_1?ie=UTF8&adId=A08345373F252PW6OUI1T&url=%2FBiwisy-50pcs-3-Ply-Disposable-Breathable%2Fdp%2FB08CXMR7R6%2Fref%3Dsr_1_248_sspa%3Fdchild%3D1%26keywords%3Dface%2Bmask%26qid%3D1618898893%26s%3Dhpc%26sr%3D1-248-spons%26psc%3D1&qualifier=1618898893&id=3507688794457423&widgetName=sp_btf,Biwisy 50pcs 3-Ply Disposable Face Mask Breathable Black Masks of 50 PCS Black,,4.6 out of 5 stars,"24,001 ratings",In Stock., Package: 50 Pcs black disposable face mask packaged in a box These Masks Should Be Disposed of after Each. 50Pcs Disposable Mask: Includes 50 pcs black disposable masks. How to use the mask: 1. Keep the black-side outside 2.Keep the nose clip on the upper side.,universal,black,,3-ply,unisex,disposable,,0
343,343,/gp/slredirect/picassoRedirect.html/ref=pa_sp_btf_hpc_sr_pg10_1?ie=UTF8&adId=A00513201CYL2HPUKFXOP&url=%2FKN95-Vibeey-Individually-Efficiency%25E2%2589%25A595-Included%2Fdp%2FB08MTRHP18%2Fref%3Dsr_1_247_sspa%3Fdchild%3D1%26keywords%3Dface%2Bmask%26qid%3D1618898893%26s%3Dhpc%26sr%3D1-247-spons%26psc%3D1&qualifier=1618898893&id=3507688794457423&widgetName=sp_btf,"KN95 Face Mask 60 Pcs, Vibeey Individually Wrapped Cup Mask, 5-Ply Layer Filter Efficiency≥95%, Included on FDA EUA List (Black)",,4.7 out of 5 stars,"3,316 ratings",In Stock.," 【Safe to Use】: Vibeey KN95 face mask black is completed with FDA standards. Can be used with confidence. Safe material is skin-friendly and softer that give you the comfortable usage experience at the same time it protects your breath with high filter efficiency. 【Provide Multi-effect Protection】: Our mask KN95 is made of high breathability 2 non-woven outer layers, 2 melt-blown inner filter, 1 non-woven cotton middle layer. The filter efficiency ≥ 95%, greatly keeping you from dust, PM 2.5, haze, smoke, automobile exhaust, etc. 【Better Design】The 3D shape of KN95 cup dust mask is designed according to the human face shape to ensure the tightness. Equipped with an adjustable soft padded nose bridge and elastic ear hooks to prevent leaving marks on your face after taking it off. 【Easy & Comfortable】: Lightweight and foldable, the 60 piece individually packaged design makes these masks easy to carry and to use. 【Upgraded Warranty】: Applicable to all public places such as home, school, indoor and outdoor. Disclaimer: This KN95 mask is NOT an N95 mask. For more information about KN95 masks please see the following before you purchase: amazon.com/AboutKN95s.",universal,black,non-woven melt-spray,kn95,unisex,,elastic,0
342,342,/Gecter-PM2-5-Activated-Filters-Replaceable/dp/B088ZX6HYX/ref=sr_1_246?dchild=1&keywords=face+mask&qid=1618898893&s=hpc&sr=1-246,Gecter 50PCS Adult PM2.5 Activated Carbon Filters 5 Layers Replaceable Anti Haze Filter Paper,,4.7 out of 5 stars,"2,660 ratings",In Stock.," Reasonable Size: PM 2.5 Filters size: 12x 8 cm/ 4.7 x 3.1 inches. Wide applications: Activated Carbon Filter anti airborne particles dust,smoke,pollution,ash,gardening pollen and so on,suitable for most occasions.Filter insert can not be cleaned and should be replaced every day. Five-layer Filtration: Multiple protection to isolate dust, multi-layer folding, good ventilation, double your protection with an additional filter. Filtration technology: made of activated carbon and non-woven melt-blown filter cloth, five-layer filter system effectively keep away from PM 2.5 and a range of airborne contaminants. High-quality materials: Made of activated carbon and non-woven melt-blown filter cloth, 5 layers filter system effectively keep away from PM2.5 and a range of airborne contaminants","adult, suitable for most, ",,non-woven melt-spray,filter pocket,unisex,,,0
339,339,/Disposable-Breathable-Comfortable-Protective-Outdoor/dp/B08CXP7SK4/ref=sr_1_243?dchild=1&keywords=face+mask&qid=1618898893&s=hpc&sr=1-243,"50 Pcs Disposable Face Mask 3-Ply Breathable & Comfortable Safety Mask, Protective Masks for Indoor and Outdoor",,4.6 out of 5 stars,652 ratings,In Stock.," Individual Package: Pack of 50 black masks. Dispose of masks after each use. All face masks are individually wrapped & sealed, so that they will not stain other masks when taken out, can be perfectly placed in your backpack, purse or into your pocket. Convenient to carry and use 3-Layer Protective: Three-layer disposable masks with high-quality safety standard non-woven fabric, which can be used by children and adults. The inner layer is made of soft facial tissue, is non-pigmented and soft to the skin. Comfortable & Breathable: High-elastic ear loops and adjustable nose clip to ensure a comfortable fit and add no strains to the ears. Easy to use, cover mouth, nose and chin. Helping to Create a Tight Seal & Stop Glasses from Fogging. Widely Use: School, office, home, public transportation, city streets, malls, parks, cycling, sports, stores & More. Effectively resist dust, particulate matter, automobile exhaust, etc. Perfect For families, office staff & warehouse workers, etc. Excellent Service - Please confirm package and products are complete asap after you receive the safety masks. If you have any doubts about HUHETA face masks, we are always here to help you.",childrens,black,non-woven melt-spray,3-ply,unisex,disposable,elastic,0
338,338,/Hatrigo-Disposable-Breathable-Adjustable-Designs/dp/B08CDL77J8/ref=sr_1_242?dchild=1&keywords=face+mask&qid=1618898893&s=hpc&sr=1-242,"Kids Face Masks, 30 Count Disposable Face Masks for Kids 5 to 12 Year Olds, Breathable Face Mask with Adjustable Nose Clip, Pink Blue Girl Designs",,4.7 out of 5 stars,201 ratings,In Stock.," BREATHABLE AND COMFORTABLE - the Hatrigo disposable face mask for kids, youth and small adults. Earloop face mask with adjustable nose clip design for a comfortable fit. SMALLER SIZE WITH SAME HIGH QUALITY STANDARDS - smaller than standard size, these kids mask are 5.75 inch x 3.5 inch and carefully produced facemasks with non-woven spunlace fabric and meltblown interior filter to last all day 3 LAYER FACE MASK - lightweight paper PPE face mask for kids and adults to help filter out most debris or dust. BUDGET VALUE PACK - 30 pack disposable masks for one-time daily use only. Each facial mask for sale is produced and inspected to ensure a high quality best face mask. RECOMMENDED AGE 5 -12 years old: kids face sizes and mask fit may vary depending on individuals. Not intended for children under the age of 2 or anyone who is unable to remove the mask without assistance",childrens,various,non-woven melt-spray,3 layer,girls,disposable,,0
337,337,/BLScode-Disposable-Protective-Comfortable-Universal/dp/B0897QZKNH/ref=sr_1_241?dchild=1&keywords=face+mask&qid=1618898893&s=hpc&sr=1-241,"BLScode Disposable Face Protective Masks, 3-Layer Facial Cover Masks with Elastic Ear Loops, Comfortable Universal Design for Adults & Kids, Suitable for Home, Office, Outdoor (Pack of 50)",,4.5 out of 5 stars,"5,247 ratings","In stock on April 24, 2021."," Breathable & Soft & Comfortable – BLScode masks with the inner skin-friendly non-woven fabric is as soft as intimate clothing, light and breathable without stimulation. 3-Ply Protective Masks – Outer color layer is a water-resistant layer, say bye to splashing liquid; Middle layer is a filtering layer, say bye to particles from 0.3 to 1.0 pm. Inner layer is a water absorbing layer, which can absorb the moisture from the breath of the wearer, avoid the filtering layer from getting wet. Easy to Use – Our protective covers are disposable and single use. Lightweight provides comfort and easy breathing while you’re at work, grocery store, or running necessary errands. Just slip the elastic bands over your ears and conform metal nose guard to create a light seal around your face. Should not be reusable. Apply new one every 2 - 4 hours for best protection to ensure moisture from breathe doesn’t dampen it. Universal Elastic Style Ear Hooks– Soft, comfortable ear bands prevent headaches when wearing for long periods of time and allow for easy modifications when fitting to both adults and small children. Convenient one size fits all styling safeguards everyone—perfect for families, office & warehouse workers & more. 100% Satisfaction - If for any reason you are unhappy with our product, please do not hesitate to contact us. We take full ownership and responsibility for the quality of our products and will do our best to solve your problem quickly and efficiently!",childrens,,non-woven melt-spray,3-ply,unisex,disposable,elastic,0
235,235,/Medical-Disposable-Portective-Breathable-EarLoops/dp/B08FDVDGMX/ref=sr_1_172?dchild=1&keywords=face+mask&qid=1618898676&s=hpc&sr=1-172,"Medical Grade Face Mask Disposable 4 Layer Black 50 PCS, Protective Breathable Face Mask with Metal Nose Wire Clip and Elastic Earloop, Safety Masks for Daily Use, Adults Women Teens Children",,4.6 out of 5 stars,418 ratings,In Stock.," Non-woven + Melt-blown 【Medical Masks】: All masks sold have passed professional sampling tests. No matter where you are, still requires attention. For others and yourself, please choose to use ours masks. 【4 Layers】: Our masks have 4 layers of materials. The outer layer of waterproof non-woven fabric, the middle layer of meltblown fabric isolation, the inner layer of skin-friendly, breathable and soft non-woven fabric absorbs the exhaled moisture. 【Comfortable to Wear】: Multi-layer foldable surface that can extend and cover from the nose to the chin. Super soft ear hooks eliminate pressure on the ears. The metal nose clip can fixed shape and forms a seal around the nose to reduces the possibility of the mask slipping off. 【Professional Face Size Design】: After professional sampling and testing, we design the mask size to 175mm * 95mm, suitable for adults and teenagers. Considering the breathability of the mask, we set the thickness of the 4-layer fabric to 0.45mm. One size fits everyone, ideal for you and your family. 【Packaging & Multi-purpose】: 4 layers of 50 pack, packed in a plastic bag in a box. It is widely used in homes, schools, offices, hair salons, outdoor work, outdoor riding.",childrens,various,non-woven melt-spray,,womens,disposable,elastic,0
236,236,/Bio-th-Reusable-Disposable-Protection-Efficiency%E3%80%8B95/dp/B089344XZF/ref=sr_1_173?dchild=1&keywords=face+mask&qid=1618898676&s=hpc&sr=1-173,Face Masks Reusable 20 Pack 5Ply Cup Dust Face Mask for Women Men with Nose Wire,,4.4 out of 5 stars,"9,460 ratings",In Stock.," [ Face Masks ], Made of 5 Layer non-woven fabric, Melt-Blown, Moisture-resistant, Non-irritant, REUSABLE Face Mask [ Masks ], High density non-woven fabric - nano filtration - filtration - highly breathable non-woven fabric that can prevent dust etc. [ Disposable Face Masks ], High level breathing protection, filter efficiency, breathable mesh composite fabric, suitable for all seasons (basically seasonal factors do not need to be considered). [ Disposable Masks ], 3D earrings and lightweight design make breathing easier. High quality elastic earbands make it comfortable to wear for a long time. [ Cup Dust Face Mask ], Non-Medical Mask, Pack of 20 Pcs. Kindly Check Size before buying. 5-Layers Breathable Non-Woven with Nose Wire and Ear Loops",universal,red,non-woven melt-spray,,unisex,disposable,elastic,0
237,237,/SOOQOO-Disposable-Face-Individually-Wrapped/dp/B08JG8MSY9/ref=sr_1_174?dchild=1&keywords=face+mask&qid=1618898676&s=hpc&sr=1-174,"SOOQOO Disposable Face Mask Individually Wrapped - 50 Pack, Camo Face Masks - Soft on Skin - 3 Ply Protectors with Elastic Earloops - Latex Free",,4.8 out of 5 stars,351 ratings,In Stock.," Each mask in this box is individually sealed so they are perfect to throw in your purse, backpack, gym bag, or even stash in your pocket! Perfect for dispensers, offices, schools and reception areas. 3 Layer construction: made of non-woven fiber fabric with 3 layer, soft and breathable Ergonomic design: with good elastic ear-loop, which can be adjusted its tightness; One size for most adult men or women.Our earloop face musk also offer a flexible nose piece that helps form a closure for better protection against exposure Designed for the utmost in comfort, these individual masks are painless and adjustable. They offer full coverage of the nose and mouth and are comfortable for extended wear, including air travel. Suitable for personal daily health.","adult, ",,non-woven melt-spray,3 ply,unisex,disposable,elastic,0
238,238,/gp/slredirect/picassoRedirect.html/ref=pa_sp_btf_hpc_sr_pg7_1?ie=UTF8&adId=A0950100S2LSADYRJJM1&url=%2FPrivate-Profile-Face-Mask-Reusable%2Fdp%2FB08H9NSZZ5%2Fref%3Dsr_1_175_sspa%3Fdchild%3D1%26keywords%3Dface%2Bmask%26qid%3D1618898676%26s%3Dhpc%26sr%3D1-175-spons%26psc%3D1&qualifier=1618898676&id=6338955721731003&widgetName=sp_btf,Private Profile Face Mask Designed By Lus Kaos- Limited Edition,,Previous page of related Sponsored Products,,In Stock.,,universal,,,,unisex,,,0
332,332,/Kids-Disposable-Face-Individually-Wrapped/dp/B08CDDT2Q1/ref=sr_1_236?dchild=1&keywords=face+mask&qid=1618898893&s=hpc&sr=1-236,"50 PCS Kids Disposable Face Mask Individually Wrapped (50, pink)",,4.6 out of 5 stars,"1,448 ratings",In Stock.," 👑👑3 LAYER COMPREHENSIVE PROTECTION : Tomrickcare disposable face masks are made with skin-friendly non-woven inner layer, more than 99% density middle melt-blown layer(the core of protection), and waterproof outer layer, which offer your comprehensive protection. 👑👑 Each Tomrickcare kids disposable face mask is in the independent packing to avoid secondary pollution during transportation. The separated package is more portable for daily using. 👑👑BREATHABLE & SKIN-FRIENDLY: Compared to cloth face mask, TomrickCare face masks are more Breathable and Skin-friendly. And the melt-blown fabric middle layer offers more protection. PS: The kids masks fit 4-12 year-old, SO THE EARLOOPS CAN BE ADJUSTED, PLEASE TIE A KNOT WHEN THE MASK IS LOOSE ON THE FACE. PULL THE BOTTOM UNDER THE CHIN and press the metal clip against the bridge of your nose for a tight seal. 👑👑FRIENDLY DESIGN: The most soft elastic ear loops won't give the pressure to the ears. With the metal adjustable nose clip bridge, TomrickCare Disposable Mask will offer a full coverage over nose and mouth with a snug secure fit. 👑👑 MORE STRICT QC TEST: Each Tomrickcare face mask passed strict pressure test, air permeability test, filterability test. We have protected millions people, and we've got high feedback from customers. Choosing us, your health we guard.",childrens,various,non-woven melt-spray,3 layer,unisex,disposable,elastic,0
239,239,/gp/slredirect/picassoRedirect.html/ref=pa_sp_btf_hpc_sr_pg7_1?ie=UTF8&adId=A00513201CYL2HPUKFXOP&url=%2FKN95-Vibeey-Individually-Efficiency%25E2%2589%25A595-Included%2Fdp%2FB08MTRHP18%2Fref%3Dsr_1_176_sspa%3Fdchild%3D1%26keywords%3Dface%2Bmask%26qid%3D1618898676%26s%3Dhpc%26sr%3D1-176-spons%26psc%3D1&qualifier=1618898676&id=6338955721731003&widgetName=sp_btf,"KN95 Face Mask 60 Pcs, Vibeey Individually Wrapped Cup Mask, 5-Ply Layer Filter Efficiency≥95%, Included on FDA EUA List (Black)",,4.7 out of 5 stars,"3,316 ratings",In Stock.," 【Safe to Use】: Vibeey KN95 face mask black is completed with FDA standards. Can be used with confidence. Safe material is skin-friendly and softer that give you the comfortable usage experience at the same time it protects your breath with high filter efficiency. 【Provide Multi-effect Protection】: Our mask KN95 is made of high breathability 2 non-woven outer layers, 2 melt-blown inner filter, 1 non-woven cotton middle layer. The filter efficiency ≥ 95%, greatly keeping you from dust, PM 2.5, haze, smoke, automobile exhaust, etc. 【Better Design】The 3D shape of KN95 cup dust mask is designed according to the human face shape to ensure the tightness. Equipped with an adjustable soft padded nose bridge and elastic ear hooks to prevent leaving marks on your face after taking it off. 【Easy & Comfortable】: Lightweight and foldable, the 60 piece individually packaged design makes these masks easy to carry and to use. 【Upgraded Warranty】: Applicable to all public places such as home, school, indoor and outdoor. Disclaimer: This KN95 mask is NOT an N95 mask. For more information about KN95 masks please see the following before you purchase: amazon.com/AboutKN95s.",universal,black,non-woven melt-spray,kn95,unisex,,elastic,0
330,330,/gp/slredirect/picassoRedirect.html/ref=pa_sp_mtf_hpc_sr_pg10_1?ie=UTF8&adId=A09359853LCFF43K1ZZTD&url=%2F100PCS-disposable-shield-filter-protection%2Fdp%2FB08C7HDF1F%2Fref%3Dsr_1_234_sspa%3Fdchild%3D1%26keywords%3Dface%2Bmask%26qid%3D1618898893%26s%3Dhpc%26sr%3D1-234-spons%26psc%3D1&qualifier=1618898893&id=3507688794457423&widgetName=sp_mtf,100PCS 3 ply black disposable face mask filter protection face masks,,4.7 out of 5 stars,"21,505 ratings",In Stock.," 1.3 Layers face mask -It's made of 3 layers of high-quality non-woven fabric; it has a stronger filtering effect and is more warm and breathable. 2.Unique Designed Masks - Comfortable elastic earloop, extra-soft ear loops eliminate pressure to the ears. Inner layer is made of soft facial tissue, no dye, gentle to the skin. 3.Made of environmental friendly material,Great choices for you or your family.Take care of yourself and hope all of trouble will be end as soon as possible.Good luck to everyone and hope all is well. 4.Black disposable face mask which great for painting, construction, building site, nail salons,fog and haze weather,gray sky,dust weather, snow weather and more 5.High quality face masks,package include 100PCS,please confirm carefully when placing an order",universal,various,non-woven melt-spray,3 ply,unisex,disposable,elastic,0
240,240,/gp/slredirect/picassoRedirect.html/ref=pa_sp_btf_hpc_sr_pg7_1?ie=UTF8&adId=A08345373F252PW6OUI1T&url=%2FBiwisy-50pcs-3-Ply-Disposable-Breathable%2Fdp%2FB08CXMR7R6%2Fref%3Dsr_1_177_sspa%3Fdchild%3D1%26keywords%3Dface%2Bmask%26qid%3D1618898676%26s%3Dhpc%26sr%3D1-177-spons%26psc%3D1&qualifier=1618898676&id=6338955721731003&widgetName=sp_btf,Biwisy 50pcs 3-Ply Disposable Face Mask Breathable Black Masks of 50 PCS Black,,4.6 out of 5 stars,"24,001 ratings",In Stock., Package: 50 Pcs black disposable face mask packaged in a box These Masks Should Be Disposed of after Each. 50Pcs Disposable Mask: Includes 50 pcs black disposable masks. How to use the mask: 1. Keep the black-side outside 2.Keep the nose clip on the upper side.,universal,black,,3-ply,unisex,disposable,,0
327,327,/dp/B08QRSWCKY/ref=sr_1_231?keywords=face+mask&qid=1618898893&s=hpc&sr=1-231,"Medtecs Disposable Face Mask, 3 layer Breathable Masks, CoverU Green 50pc",,4.5 out of 5 stars,626 ratings,In Stock.," 【3-ply Face Mask Providing Full Protection】The disposable face mask is made of 3 layers of high-quality non-woven fabric. The inner PP meltblown layer is for filtration, and the 2 PP spunbond layers are for water-resistance and ventilation. 【ASTM Level 1 Protection】The face mask is anti-dust, anti-spittle and anti-smog, with a filtration efficiency over 95%. 【Elastic Ear Loops & Adjustable Nose Clip】The ear loops are super elastic and fatigue-resistant, perfect for pain-free, all-day wear. Even if you pull them up to 30 cm, they won't be loose. In addition, the bendable nose wire can comfortably fit your nose and keep your glasses from fogging up. 【For Both Public & Healthcare Settings】There are 50 pieces in each box. One size fits all. It can be used not only for daily protection, but also for healthcare settings. 【How to Wear】Step1, Wash your hands before putting on your mask. Step2, Put it over your nose and mouth and secure it under your chin. Step3, Try to fit it snugly against the sides of your face.",universal,green,non-woven melt-spray,3-ply,unisex,disposable,elastic,0
351,351,/WeCare-Individually-Wrapped-Disposable-5-7x3-7/dp/B08DTHCKJP/ref=sr_1_247?dchild=1&keywords=face+mask&qid=1618898965&s=hpc&sr=1-247,"WeCare Disposable Face Masks For Kids, 50 Navy Face Masks, Individually Wrapped",,4.6 out of 5 stars,"2,882 ratings",In Stock.," PERFECT FOR KIDS: Sized at 3.7 inches x 5.7 inches, they fit comfortably on boys and girls, even toddlers! Now you can take your children with you to the store, go on trips, and send them to school or camp safely! READY TO GO: Each mask in this box is individually sealed so they are perfect to throw in your purse, handbag, or stash in your child's pocket or backpack and they will remain sanitary and clean! CUTEST COLORS & DESIGNS: Let your kid be the cutest boy or girl on the block with this adorable navy mask. WeCare also has children’s masks in more than a dozen solid colors and fun prints, as well as matching adult masks. LIGHT & BREATHABLE: Designed for the utmost in comfort, these masks are painless and adjustable. They offer full coverage of the nose and mouth and allow kids to play and learn freely. 3 PROTECTIVE LAYERS: The innermost layer is super soft and gentle on the skin, and the outer leak-proof layer covers the high density filter. Latex free. An adjustable metal wire runs along the top as a nose clip.",childrens,navy,,,unisex,disposable,,0
